"DESCRIPTION","DURATION IN MS","NAME","PARENT SUITE","START TIME","STATUS","STOP TIME","SUB SUITE","SUITE","TEST CLASS","TEST METHOD"
"","130","Should check if connection scheme exists","","2025-11-01","passed","2025-11-01","","Connection Scheme Repository SQL Implementation Tests","com.connection.scheme.integration.ConnectionSchemeRepositorySQLImplIntegrationTest","shouldCheckIfConnectionSchemeExists"
"","103","Should add connection scheme successfully","","2025-11-01","passed","2025-11-01","","Connection Scheme Repository SQL Implementation Tests","com.connection.scheme.integration.ConnectionSchemeRepositorySQLImplIntegrationTest","shouldAddConnectionSchemeSuccessfully"
"","172","Should update connection scheme successfully","","2025-11-01","passed","2025-11-01","","Connection Scheme Repository SQL Implementation Tests","com.connection.scheme.integration.ConnectionSchemeRepositorySQLImplIntegrationTest","shouldUpdateConnectionSchemeSuccessfully"
"","40","Should throw exception when connection scheme not found by UID","","2025-11-01","passed","2025-11-01","","Connection Scheme Repository SQL Implementation Tests","com.connection.scheme.integration.ConnectionSchemeRepositorySQLImplIntegrationTest","shouldThrowExceptionWhenConnectionSchemeNotFoundByUid"
"","109","Should find connection schemes by client UID","","2025-11-01","passed","2025-11-01","","Connection Scheme Repository SQL Implementation Tests","com.connection.scheme.integration.ConnectionSchemeRepositorySQLImplIntegrationTest","shouldFindConnectionSchemesByClientUid"
"","97","Should find connection scheme by UID","","2025-11-01","passed","2025-11-01","","Connection Scheme Repository SQL Implementation Tests","com.connection.scheme.integration.ConnectionSchemeRepositorySQLImplIntegrationTest","shouldFindConnectionSchemeByUid"
"","132","Should delete connection scheme successfully","","2025-11-01","passed","2025-11-01","","Connection Scheme Repository SQL Implementation Tests","com.connection.scheme.integration.ConnectionSchemeRepositorySQLImplIntegrationTest","shouldDeleteConnectionSchemeSuccessfully"
"","1579","Should throw exception when adding connection scheme with duplicate UID","","2025-11-01","passed","2025-11-01","","Connection Scheme Repository SQL Implementation Tests","com.connection.scheme.integration.ConnectionSchemeRepositorySQLImplIntegrationTest","shouldThrowExceptionWhenAddingConnectionSchemeWithDuplicateUid"
"","129","Should find connection schemes by buffer UID","","2025-11-01","passed","2025-11-01","","Connection Scheme Repository SQL Implementation Tests","com.connection.scheme.integration.ConnectionSchemeRepositorySQLImplIntegrationTest","shouldFindConnectionSchemesByBufferUid"
